{
  "masthead" : {
    "align" : "centre",
    "contactSize" : 8.7,
    "contacts" : "flow",
    "finish" : "capped",
    "gapAfter" : 20,
    "headlineColour" : "accent",
    "headlineItalic" : false,
    "headlineSize" : 10.6,
    "nameBold" : true,
    "nameSize" : 25,
    "rule" : {
      "colour" : "ink",
      "double" : false,
      "thickness" : 0.8,
      "underName" : false,
      "width" : 0
    },
    "tracking" : -0.3,
    "uppercase" : false
  },
  "name" : "monogram",
  "pairsWith" : "bulletin",
  "typeface" : "sans"
}
