{
  "masthead" : {
    "align" : "left",
    "contactSize" : 8.8,
    "contacts" : "ranged",
    "finish" : "rule",
    "gapAfter" : 24,
    "headlineColour" : "muted",
    "headlineItalic" : true,
    "headlineSize" : 11,
    "nameBold" : false,
    "nameSize" : 24,
    "rule" : {
      "colour" : "ink",
      "double" : false,
      "thickness" : 0.7,
      "underName" : false,
      "width" : 0
    },
    "tracking" : 0.2,
    "uppercase" : false
  },
  "name" : "letterhead",
  "pairsWith" : "broadsheet",
  "typeface" : "serif"
}
