{
  "masthead" : {
    "align" : "left",
    "contactSize" : 8.7,
    "contacts" : "flow",
    "finish" : "rule",
    "gapAfter" : 22,
    "headlineColour" : "accent",
    "headlineItalic" : false,
    "headlineSize" : 10.2,
    "nameBold" : true,
    "nameSize" : 22,
    "rule" : {
      "colour" : "ink",
      "double" : false,
      "thickness" : 0.9,
      "underName" : false,
      "width" : 0
    },
    "tracking" : -0.3,
    "uppercase" : false
  },
  "name" : "memo",
  "pairsWith" : "ledger",
  "typeface" : "sans"
}
