{
  "masthead" : {
    "align" : "left",
    "contactSize" : 8.7,
    "contacts" : "panel",
    "finish" : "none",
    "gapAfter" : 22,
    "headlineColour" : "accent",
    "headlineItalic" : false,
    "headlineSize" : 11,
    "nameBold" : true,
    "nameSize" : 25,
    "photo" : {
      "align" : "right",
      "diameter" : 74
    },
    "rule" : {
      "colour" : "ink",
      "double" : false,
      "thickness" : 0.9,
      "underName" : false,
      "width" : 0
    },
    "tracking" : -0.4,
    "uppercase" : false
  },
  "name" : "panel",
  "pairsWith" : "banner",
  "typeface" : "sans"
}
